{
  "schema_version": 1,
  "organization_id": "0198a7b5-4c03-7dd8-8e88-fc11c6f65561",
  "revision_id": "0198a7b5-5d12-7a8f-8d67-3921e9698ea4",
  "created_at": "2026-07-12T08:00:00Z",
  "archive": {
    "digest": "sha256:aaaaaaaaaaaaaaaaaaaaaaaaaaaaaaaaaaaaaaaaaaaaaaaaaaaaaaaaaaaaaaaa",
    "media_type": "application/x-tar",
    "size": 10240
  },
  "files": [
    {
      "path": "assets/app.1234abcd.js",
      "digest": "sha256:bbbbbbbbbbbbbbbbbbbbbbbbbbbbbbbbbbbbbbbbbbbbbbbbbbbbbbbbbbbbbbbb",
      "media_type": "application/javascript; charset=utf-8",
      "size": 21,
      "cache_control": "public, max-age=31536000, immutable"
    },
    {
      "path": "index.html",
      "digest": "sha256:cccccccccccccccccccccccccccccccccccccccccccccccccccccccccccccccc",
      "media_type": "text/html; charset=utf-8",
      "size": 23,
      "cache_control": "no-cache, must-revalidate"
    }
  ]
}
